{
  "adapterId": "fixture-incompatible-version",
  "adapterVersion": "1.0.0",
  "project": {
    "id": "fixture-project",
    "detection": {
      "rootMarkers": [{"kind": "file", "path": "package.json"}],
      "maximumDepth": 1,
      "scope": "declared-project-root",
      "requireApprovalOutsideScope": true
    }
  },
  "supportedSkills": [
    {
      "id": "repo-map",
      "compatibleVersions": ["0.1.0"],
      "declaredMode": "audit-only"
    }
  ],
  "extensions": {
    "safeReadPaths": ["README.md"],
    "ignoredPaths": [],
    "documentationPrecedence": [],
    "commandAliases": [],
    "safeStatusCommands": [],
    "requiredEvidence": ["repository root"],
    "expectedRuntimeManagers": [],
    "expectedPackageManagers": ["none"]
  },
  "approvalRequirements": [],
  "inheritance": {
    "sharedRestrictions": "required",
    "deniedOperationCategories": [
      "file-write",
      "package-install",
      "deployment",
      "git-mutation",
      "unrestricted-scan",
      "secret-read",
      "process-mutation",
      "service-mutation",
      "migration-apply",
      "privileged-api"
    ],
    "allowRestrictionRemoval": false,
    "allowModeOverride": false,
    "allowFailureSuppression": false,
    "allowCompletionOverride": false,
    "allowSecretExposure": false,
    "allowRequiredEvidenceRemoval": false,
    "allowScopeExpansionWithoutApproval": false
  }
}
