{
  "adapterId": "sample-documentation-precedence",
  "adapterVersion": "1.0.0",
  "project": {
    "id": "sample-project",
    "detection": {
      "rootMarkers": [
        {
          "kind": "directory",
          "path": "docs"
        }
      ],
      "maximumDepth": 1,
      "scope": "declared-project-root",
      "requireApprovalOutsideScope": true
    }
  },
  "supportedSkills": [
    {
      "id": "llm-drift-control",
      "compatibleVersions": ["0.1.x"],
      "declaredMode": "audit-only"
    }
  ],
  "extensions": {
    "safeReadPaths": ["README.md", "docs", "src", "test"],
    "ignoredPaths": ["docs/generated"],
    "documentationPrecedence": [
      "docs/architecture/README.md",
      "docs/product/README.md",
      "README.md"
    ],
    "commandAliases": [],
    "safeStatusCommands": [],
    "requiredEvidence": ["source reference", "test reference", "documentation reference"],
    "expectedRuntimeManagers": [],
    "expectedPackageManagers": ["none"]
  },
  "approvalRequirements": [],
  "inheritance": {
    "sharedRestrictions": "required",
    "deniedOperationCategories": [
      "file-write",
      "package-install",
      "deployment",
      "git-mutation",
      "unrestricted-scan",
      "secret-read",
      "process-mutation",
      "service-mutation",
      "migration-apply",
      "privileged-api"
    ],
    "allowRestrictionRemoval": false,
    "allowModeOverride": false,
    "allowFailureSuppression": false,
    "allowCompletionOverride": false,
    "allowSecretExposure": false,
    "allowRequiredEvidenceRemoval": false,
    "allowScopeExpansionWithoutApproval": false
  }
}
