{
  "adapterId": "sample-runtime-status",
  "adapterVersion": "1.0.0",
  "project": {
    "id": "sample-service",
    "detection": {
      "rootMarkers": [
        {
          "kind": "file",
          "path": "package.json"
        }
      ],
      "maximumDepth": 1,
      "scope": "declared-project-root",
      "requireApprovalOutsideScope": true
    }
  },
  "supportedSkills": [
    {
      "id": "runtime-truth",
      "compatibleVersions": ["0.2.0"],
      "declaredMode": "audit-only"
    }
  ],
  "extensions": {
    "safeReadPaths": ["README.md", "package.json"],
    "ignoredPaths": ["logs"],
    "documentationPrecedence": ["README.md"],
    "commandAliases": [
      {
        "alias": "service-status",
        "skillId": "runtime-truth",
        "family": "runtime-status",
        "command": "systemctl --user status sample.service --no-pager"
      }
    ],
    "safeStatusCommands": [
      {
        "manager": "systemd-user",
        "command": "systemctl --user status sample.service --no-pager"
      }
    ],
    "requiredEvidence": ["manager status", "listener ownership", "health response"],
    "expectedRuntimeManagers": ["systemd-user"],
    "expectedPackageManagers": ["npm"]
  },
  "approvalRequirements": [
    {
      "operation": "authenticated-health-check",
      "required": true,
      "reason": "Authenticated health checks require a separately approved workflow."
    }
  ],
  "inheritance": {
    "sharedRestrictions": "required",
    "deniedOperationCategories": [
      "file-write",
      "package-install",
      "deployment",
      "git-mutation",
      "unrestricted-scan",
      "secret-read",
      "process-mutation",
      "service-mutation",
      "migration-apply",
      "privileged-api"
    ],
    "allowRestrictionRemoval": false,
    "allowModeOverride": false,
    "allowFailureSuppression": false,
    "allowCompletionOverride": false,
    "allowSecretExposure": false,
    "allowRequiredEvidenceRemoval": false,
    "allowScopeExpansionWithoutApproval": false
  }
}
